{
  "case_id": "grouping-006",
  "category": "grouping",
  "source": {
    "doc_ref": "TEST3-FAILURE-ANON",
    "block_ids": [
      "T3-ANON-ROW-48"
    ],
    "origin": "anonymized_rewrite",
    "curated_by": "Codex",
    "curated_at": "2026-07-22"
  },
  "input": {
    "text": "The meter shall record the load profile in 24-hour intervals.",
    "context": "Load profile recording"
  },
  "expected": {
    "verdict": "daily-profile-recording",
    "group_key": "daily-profile-recording",
    "rationale": "The 15-minute and 24-hour profiles are two distinct profile objects (two separate requirements), not one function's period variants (reviewer ruling 2026-07-23).",
    "forbidden": [],
    "must_ask_questions": []
  },
  "notes": "Anonymized from a real daily load-profile row; paired with grouping-005 as a NEGATIVE pair after the reviewer ruling: two independent profile requirements must not merge."
}
