{
  "case_id": "hallucination-003",
  "category": "hallucination",
  "source": {
    "doc_ref": "TEST18-ANON",
    "block_ids": ["T18-ANON-HALL-01", "T18-ANON-HALL-02"],
    "origin": "anonymized_rewrite",
    "curated_by": "Codex",
    "curated_at": "2026-07-22"
  },
  "input": {
    "text": "The replaceable battery shall support field replacement. The sealed backup battery is non-replaceable.",
    "context": "Rejected merge: All batteries shall be field replaceable."
  },
  "expected": {
    "verdict": "reject",
    "detector": "opposed_qualifiers",
    "rationale": "The merge erases opposed qualifiers from two distinct battery requirements.",
    "forbidden": ["All batteries shall be field replaceable"],
    "must_ask_questions": []
  },
  "notes": "Anonymized from the opposed-battery grouping regression."
}
