{
  "case_id": "grouping-005",
  "category": "grouping",
  "source": {
    "doc_ref": "TEST3-FAILURE-ANON",
    "block_ids": [
      "T3-ANON-ROW-47"
    ],
    "origin": "anonymized_rewrite",
    "curated_by": "Codex",
    "curated_at": "2026-07-22"
  },
  "input": {
    "text": "The meter shall record the load profile in 15-minute intervals.",
    "context": "Load profile recording"
  },
  "expected": {
    "verdict": "same_group",
    "group_key": "load-profile-period-recording",
    "rationale": "The 15-minute variant is one period option of the same load-profile recording function.",
    "forbidden": [],
    "must_ask_questions": []
  },
  "notes": "Anonymized from a real 15-minute load-profile row; paired with grouping-006."
}
