{
  "case_id": "hallucination-004",
  "category": "hallucination",
  "source": {
    "doc_ref": "TEST2-TENDER-ANON",
    "block_ids": ["T2-ANON-HALL-01"],
    "origin": "anonymized_rewrite",
    "curated_by": "Codex",
    "curated_at": "2026-07-22"
  },
  "input": {
    "text": "Compliance shall be demonstrated against Decree 161/2019 and Act 142/2000.",
    "context": "Rejected candidate: The product shall be certified to IEC 62053-22."
  },
  "expected": {
    "verdict": "reject",
    "detector": "foreign_standard_refs",
    "rationale": "The candidate substitutes a different compliance instrument for the two source instruments.",
    "forbidden": ["IEC 62053-22"],
    "must_ask_questions": []
  },
  "notes": "Anonymized from the multiple-instrument audit regression."
}
